{
  "$schema": "./marketplace.schema.json",
  "name": "just-be",
  "owner": {
    "name": "Justin Bennett"
  },
  "metadata": {
    "description": "Jeb's marketplace of Claude Code skills and plugins",
    "version": "1.0.0",
    "pluginRoot": "./plugins"
  },
  "plugins": [
    {
      "name": "claude-web",
      "source": "./plugins/claude-web",
      "description": "Claude Code web startup hooks for automated mise setup"
    },
    {
      "name": "conductor",
      "source": "./plugins/conductor",
      "description": "Conductor integration plugin for setting up workspace configuration"
    },
    {
      "name": "dev",
      "source": "./plugins/dev",
      "description": "Common dev shortcuts and workflow commands"
    },
    {
      "name": "effect",
      "source": "./plugins/effect",
      "description": "Effect-TS integration plugin for setting up and working with Effect projects"
    },
    {
      "name": "github",
      "source": "./plugins/github",
      "description": "GitHub integration plugin for repository setup and configuration"
    },
    {
      "name": "mise",
      "source": "./plugins/mise",
      "description": "Mise integration plugin for managing development tools and environments"
    },
    {
      "name": "meta",
      "source": "./plugins/meta",
      "description": "Meta plugin for managing and creating plugins in the just-be-dev/skills marketplace"
    },
    {
      "name": "skills-sh",
      "source": "./plugins/skills-sh",
      "description": "Shell-based skills plugin for custom command execution and automation"
    }
  ]
}
